2025-10-17 11:04:02,Who is a loan holder?,"A loan holder is a organization that holds the promissory note for a loan, such as the Education Department (ED) which is the loan holder for all Direct Loans and many Federal Program loans purchased from the original loan holders.
",chunk_8,0.592
2025-10-17 11:16:20,Who is a loan holder?,"A loan holder is the organization or entity that holds a promissory note for a student's loan, effectively owning it. This distinction becomes important when considering repayment options and understanding who to communicate with regarding one’s federal education debt, as this will vary depending on whether they are dealing directly with their Loan holder (like the U.S. Department of Education in some cases) or a different entity that may handle loan servicing for them.

",chunk_8,0.592
2025-10-17 11:18:24,where to make the loan payments,"Time to repay your student loan depends on which Income-driven Repayment plan you choose. You'll have a monthly Payment amount that is based on what percentage of your income goes towards paying for basic living expenses, with the remaining money going toward Loan repayment each month. This ensures affordability and can be recalculated every year if there are significant changes in your financial situation or cost-of-living adjustments (COLAs).

For Federal Student Loans: The 10-year Standard Repayment Plan has a set amount due each month for up to ten years, while the Income-Based Repayment plan lengthens repayment time and typically results in lower payments. These plans are designed so that your Payment will never exceed three times more than what you would have paid under Standard Repayment over 10 years; however, if you choose to make higher monthly contributions or do not qualify for income-driven repayment options due to the size of your loan balance relative to your expected family contribution and total amount owed after graduation/leaving school, then standard repayment may be an option.

It's important that you consult with a representative from Loan Servicer about all available plan options before deciding which is best suited for both the short-term affordability of loan payments and long term goal completion within 10 years or more extended terms under income driven plans like Pay As You Earn (PAYE) if eligible.

","chunk_18,chunk_19",0.506
2025-10-17 11:24:40,where to make the loan payments for a graduated repayment plan?,"To make loan payments for a graduated repayment plan, borrowers should follow these steps and refer to the official StudentAid.gov resources provided in the document excerpts above (Sources):

1. Choose an affordable Repayment Plan that suits your financial situation based on Income-Based Repayment (IBR) or Pay As You Earn (PAYE), which are repayment plans designed to be income-driven, as mentioned in the document: "". If you haven't yet found a job, there are Repayment Options available...""
   
2. Use the official StudentAid.gov/Repayment-estimator tool for more detailed information and calculate your estimated repayment amount under each plan (Source chunk_14). This will give borrowers an idea of their monthly payment obligations based on different plans' terms, such as IBR or Paye that are intended to be affordable based on Income.
   
3. Change Repayment plans at any time if necessary by contacting your Loan servicer since plan changes can happen due to a change in circumstances like income (Source chunk_15). For instance, Direct Unsubsidized Loans Revised Pay As You Earn and IBR Plan are options available for eligible borrowers.
   
4. Understand that repayment plans such as Income-Contingent Repayment plan include forgiveness after 20 or 25 years of payments if you haven't fully paid your loan balance, which is an important consideration when managing long-term financial obligations (Source chunk_23).
   
By following these outlined steps and utilizing the resources provided by StudentAid.gov/repayment and other official government websites related to student loans, borrowers can effectively manage their payments according to a graduated repayment plan that aligns with their financial situation over time.",,0.651
2025-10-17 11:28:24,what loans are eligible  for a graduated repayment plan?,"Eligible loans for a graduated repayment plan include Direct Unsubsidized Loans, Direct PLUS Loans made to students by parents under the Direct Loan Program borrowers who have more than $30,000 of such direct loan balances and enrolled in college or graduate school on or after October 7, 1998. Borrowers must also meet additional eligibility requirements as detailed at StudentAid.gov/repay.",,0.611
2025-10-17 11:36:30,what loans are eligible  for a graduated repayment plan?,"Loans eligible for a graduated repayment plan include Direct Unsubsidized Loans, Direct PLUS Loans made to students (borrowers who are not graduate or law school students), and Direct Consolidation Loans that do not already have an established Repayment Plan. 
","chunk_20, chunk_17",0.611
2025-10-17 11:39:30,who is a loan agent,"A loan agent is an individual who helps borrowers navigate the process of getting a loan and managing their repayment responsibilities. In the context provided, there are references to Loan holders like ED (possibly referring to the Department of Education) which holds Direct loans for students and also mentions other types such as Perkins Loans often held by schools themselves or through an intermediary servicer organization. However, it does not specifically mention a person who acts solely as a loan agent in this excerpt from .gov/login (which seems to be the source of these texts). Generally speaking, some universities and financial institutions may have Loan agents working directly with borrowers or their representatives like parents for Direct PLUS loans. These individuals would facilitate various aspects such as understanding loan terms, submitting paperwork if needed, providing guidance on repayment options (like Income-Driven Repayment plans) and dealing with the Loan holder when required. The provided content mainly discusses types of student loans like Direct Subsidized Loans, Unsubsidized Loans under Pay As You Earn plan which includes both subsidy and non-subsidy aspects based on different criteria including financial need for subsiided ones or eligibility without regard to income. It also touches upon capitalization of interest during periods like grace period when the payments are not active but doesn't directly identify a loan agent role in this excerpt from .gov/login ",,0.413
2025-10-17 11:48:10,what will happen when i repay my loan early,"If you repay your loan early, there will be no penalty as per the document. You can prepay any or all of it at any time without incurring additional costs. It is always advisable to pay off debts ahead of schedule when possible and if doing so doesn't impede on other financial commitments based on one's income, expenses, and budget as suggested in the document chunks 10-13.
=========",,0.627
2025-10-17 13:43:28,how to resolve loan problems quickly,"Consolidation can resolve loan problems quickly by combining multiple loans into a single loan with potentially lower monthly payments, but it is essential to consider that this may lead to higher overall interest costs over time. To consolidate federal student loans in the United States, borrowers typically have several options available through various government agencies and private lenders:

1. Federal Direct Consolidation Loan (FDSL): This loan allows borrowers with multiple federal student loans to combine them into a single direct loan with one monthly payment. Interest rates are fixed or variable based on the consolidation date, offering predictability in budgeting and potentially longer repayment terms that might lower payments but increase total interest paid over time.

2. Private Loan Consolidation: If borrowers have private student loans, they can seek a loan modification through their lenders or consolidate with a new private education loan from different credit providers using services like Education Credit Management Corporation (ECMC). The terms and interest rates for these options vary widely among institutions.

3. State Consolidation Programs: Some states offer programs to help borrowers manage student loans, including repayment plans that might reduce monthly payments or extend the loan term without incurring additional costs associated with private lenders' fees and charges. 

4. Federal Student Loan Forgiveness Programs (e.g., Teacher Loan Forgiveness): Under certain programs, borrowers can have a portion of their student loans forgiven after making payments for an extended period or working in specific fields such as education, public service, or healthcare.

5. Pay As You Earn Repayment Plan (PAYE): This plan sets the borrower's monthly payment amount based on income and family size but does not change over time. After 20 to 25 years of consistent payments under PAYE, any remaining loan balance may be forgiven by the government for federal student loans (not applicable for private loans).

6. Income-Driven Repayment Plans: These plans adjust repayment amounts based on borrowers' income and family size to ensure affordability during periods of unemployment or economic hardship while still maintaining some level of monthly payment towards loan balance reduction over time, often extending the term up to 20 years.

7. Loan Refinancing: While not a consolidation in itself (as it involves replacing an existing student loan with another new one), refinancing can sometimes be used alongside other methods for better terms or interest rates and potentially quicker resolution of repayment challenges if the borrower secures significant savings.

It's crucial to thoroughly research these options, understand their implications on total cost over time due to accrued interest, potential penalties associated with prepayment, and how they impact credit scores before making a decision about consolidating student loans for quicker resolution of payment problems or simplifying repayment. Borrowers should also consider the importance of maintaining an emergency fund as part of their overall financial strategy to handle unexpected events without defaulting on loan payments.

","32-pl, chunk_18-pl",0.538
2025-10-17 13:47:13,how to resolve loan problems quickly,"- Contact your loan service immediately if you cannot make full payments or need to arrange a partial payment. Learn more about deferment and forbearance options which may change your repayment plan based on income, extending the period for repaying your loans can result in lower monthly Payments but usually comes with higher overall interest paid over time.
- Consolidation might be an option to consider if you believe there is a balance error or just want easier management of multiple student loans. This could extend the loan term, potentially resulting in smaller payments that increase gradually every two years up to three times your minimum payment amount but remember this plan may result in more interest paid over time compared to standard repayment plans with fixed monthly amounts due within a set period like 10 or 25 years.
- For borrowers who haven't found employment yet, several Repayment options are available that accommodate their current situation by offering lower Payments while providing the ability for you to pay back your Loan when financially able to do so; these plans consider Income and may extend repayment time up to 25 years.
- For a quicker resolution of loan problems, contacting your service provider immediately is advised as they can provide options specific to individual circumstances including partial Payments or deferment/forbearance which might adjust the Repayment plan terms based on financial need and Income assessment; this could also help with disputes over incorrect balance charges.
- Additionally, creating a Budget using resources available at StudentAid.gov can assist in managing your finances more effectively while searching for work or navigating repayment challenges.",,0.538
2025-10-17 13:51:55,how to resolve loan problems quickly,"For resolving loan problems quickly, consider contacting your lender or servicer immediately if you're unable to make payments. You may be eligible for deferment or forbearance which can change your repayment plan based on a longer period of time due to income changes (Income-Based Repayment Plan), or even extend the loan term and reduce monthly payments at the cost of more interest paid over time. Consolidation is another option if you believe there's an error in account balance which might lead to lowering your payment by extending repayment period, though it could mean higher total interest costs. Remember that ignoring notices can worsen problems and potentially result in default. To get detailed information about the Repayment options available for federal student loans or specific help with resolving disputes regarding loan balances:

","chunk_32,chunk_35",0.538
2025-10-17 13:55:52,how to resolve loan problems quickly,"To resolve loan problems quickly, consider contacting your loan service immediately to explore options such as partial payments or request a deferment/Forbearance if you're facing financial difficulties. Also, look into consolidation and Loan forgiveness programs that may be applicable to your situation while ensuring timely repayment of any outstanding balance due in accordance with the terms set by StudentAid.gov for Consolidation or Repayment plans based on Income (IBR), Standard Repayment, Graduated Repayment plan etc., and if necessary seek professional financial advice as well to better prepare yourself before you decide any course of action concerning your loan situation.
","chunk_32,chunk_14",0.538
2025-10-17 13:57:47,how to resolve loan problems quickly,"To resolve loan problems quickly, it is advised to contact your Loan service immediately if you're unable to make full or partial payments. You can learn more about deferment and forbearance options at may be able to change your repayment plan based on income or explore consolidation for potentially lower monthly payments over a longer period, although there might be tradeoffs involved with such decisions. It's also beneficial to check eligibility for loan forgiveness programs if applicable. For specific instructions and information tailored to individual circumstances regarding these options, visiting StudentAid.gov/Consolidation or reviewing your account details at the student aid website can provide more detailed guidance.",,0.538
2025-10-17 14:01:25,how to resolve loan problems quickly,"To resolve loan problems quickly, you should contact your loan service immediately if you're having trouble making payments. They can offer help such as deferment and forbearance to change your repayment plan based on income or extend the period for repaying your loans which may lower your monthly payment amount. Additionally, exploring options like consolidation before deciding might also be beneficial in simplifying payments but one should consider possible trade-offs carefully after understanding advantages and disadvantages of such a move. For detailed information on resolving disputes or for further assistance with loan management strategies, including budgeting if necessary, you can visit StudentAid.gov/repay to access comprehensive resources provided by the U.S. Department of Education.

",chunk_32 and 35,0.538
2025-10-17 14:52:07,how to resolve loan problems quickly,"To resolve loan problems quickly, contact your loan service immediately to discuss partial payments or deferment. You can also learn more about consolidation options and how they might extend the repayment period for a lower monthly payment. Be sure to check eligibility for loan forgiveness programs as well if applicable. To get detailed information on resolving disputes, visit StudentAid.gov/repay for further guidance.
","chunk_32,chunk_35,chunk_18",0.538
